{
  "$schema": "https://spec.aixin.io/schemas/outcome-contract.schema.json",
  "objective": "Rebook Anna on any BA flight to LHR within 7 days, under $2000.",
  "success_metrics": [
    { "name": "spend_usd",   "op": "<=", "value": 2000 },
    { "name": "carrier",     "op": "==", "value": "BA" },
    { "name": "destination", "op": "in", "value": ["LHR"] }
  ],
  "out_of_scope": ["hotel_booking", "car_rental"],
  "principal": "did:pkh:eip155:97:0xA11ceAnna",
  "created_at": "2026-07-24T10:00:00Z"
}
